task_id,soc_code,label,eloundou_label,explanation
39,11-3051.00,E2,E2,"An LLM chat interface alone can help draft quality-control documents but cannot examine physical samples or pull real-time test data, so it would not halve the overall effort. However, with software built on top of the LLM that ingests sensor readings, lab reports, and production logs, the model could automatically summarize results, flag deviations, and suggest adjustments—cutting the manager’s monitoring and standards-setting time by more than half."
32,11-3051.00,E2,E2,"An LLM chat alone can help draft plans or summarize reports, but most value comes from software that plugs the model into live production, inventory, and sales data to generate schedules, alerts, and coordinated instructions; such an integrated tool could plausibly cut the manager’s coordination time in half, whereas the bare chat interface cannot."
34,11-3051.00,E1,E2,"The schedules and orders can be pasted (or summarized) as text; the LLM can rapidly analyze the requirements, cross-check against budgets/time limits, and draft recommended inventory levels, staffing numbers, and duty assignments, cutting the manager’s planning time well over half while the manager simply reviews and signs off."
35,11-3051.00,E2,E2,"Resolving production problems requires quickly digesting equipment logs, quality reports, schedules, and workers’ comments. An LLM on its own can draft emails or brainstorm solutions, but cutting the problem-solving time in half would require software that pipes in live plant data and staff notes for the model to summarize and diagnose. Such an LLM-powered dashboard is feasible, but simple chat access alone would not be enough."
36,11-3051.00,E2,E0,"The underlying decisions and in-person discussions must still be handled by the manager, so a chat-only LLM would not cut the work time in half. However, an HR application built on top of an LLM could screen résumés, auto-draft interview questions, performance reviews, disciplinary letters, and grievance responses, greatly reducing the administrative load and likely halving total task time."
40,11-3051.00,E1,E2,"A chat-based LLM can draft procedures for production-tracking and QC systems, write spreadsheet/SQL/Python code to implement them, and rapidly analyze text or tabular reports that the manager pastes into the chat, flagging anomalies and suggesting remedies—cutting the time required by well over half without extra specialized software."
38,11-3051.00,E1,E1,"Drafting, updating, and formatting production reports or personnel records is largely text-based; feeding the relevant data or notes to the LLM lets it generate or revise the documents quickly, cutting the manager’s writing time by more than half without requiring extra software beyond the chat interface."
41,11-3051.00,E2,E2,"An LLM could help summarize and critique complex technical plans, draft questions, and suggest process improvements, but managers still need to hold meetings and negotiate decisions with staff, and plans often exceed the model’s direct context window. With an added layer of software that ingests large internal documents and surfaces relevant information, the overall time for this task could be cut in half; the plain chat interface alone is unlikely to achieve that threshold."
33,11-3051.00,E2,E2,"The manager must draw on large, organization-specific datasets from ERP/finance systems and coordinate approvals; an LLM chat alone can help draft narratives or suggest formulas but cannot automatically pull, reconcile, and monitor up-to-date cost, labor, and production data. With dedicated software that integrates those data sources and uses the LLM for analysis and drafting, the time to build and approve budgets could be cut in half, so the task fits E2."
44,11-3051.00,E2,E2,"The LLM by itself cannot fetch and monitor new quality-control literature, but a software layer that continually retrieves the latest articles, patents, and statistical studies and pipes them to the LLM for summarization and synthesis would cut the manager’s effort by more than half."
43,11-3051.00,E1,E2,"The task is largely text- and planning-oriented (drafting procedures, schedules, recommendations, comparison memos, emails to vendors, etc.). An LLM can quickly generate or refine these documents, suggest maintenance best practices, and structure coordination plans from the information the manager supplies, cutting the manual writing/research effort well beyond half. Physical inspection or final decisions still need humans, but the documentation and analytical portions are directly accelerable via chat with the LLM."
37,11-3051.00,E2,E2,"An LLM by itself can draft policies or give generic advice, but real efficiency gains come from software that plugs the LLM into the firm’s live inventory and cost data, then auto-generates analyses, alerts, and rollout plans. Such an integrated tool could easily cut the time required to launch and manage inventory or cost-control programs by more than half."
45,11-3051.00,E2,E2,"An LLM could draft emails or talking points, but effective price negotiations hinge on live interpersonal exchange and up-to-date market data that the model alone lacks; specialized software combining current pricing databases and LLM-generated bargaining scripts could plausibly halve the time, whereas simple chat access would not."
21332,11-3051.00,E2,E2,"The physical walk-through cannot be automated, but a purpose-built LLM app could supply dynamic checklists, capture verbal notes, cross-reference regulations, and auto-draft the audit report, so software layered on the LLM could plausibly cut total audit time by half."
21333,11-3051.00,E2,E2,"A chat-only LLM can help draft written procedures, but enforcing them requires monitoring shop-floor data, checking logs, sending alerts, etc.—functions the LLM cannot perform by itself. However, software built on top of an LLM that plugs into manufacturing-execution and quality systems could auto-generate SOPs, flag deviations, and produce compliance reports, cutting the time managers spend developing and enforcing procedures by at least half."
21334,11-3051.00,E0,E2,"Putting procedures into practice demands on-site coordination, training, and real-time decision-making and action; while an LLM might help draft documents, it cannot meaningfully shorten the overall hands-on implementation effort."
21335,11-3051.00,E1,E2,"Preparing and updating written compliance records is largely a text-generation and editing activity; an LLM can quickly draft, format, and revise these documents from provided data and guidelines, cutting the required documentation time by more than half."
21336,11-3051.00,E2,E2,"A standalone LLM chat cannot pull live regulatory data, but software built on top of the LLM could automatically scrape relevant agency sites, feed the new text to the LLM, and generate concise alerts—halving the monitoring effort."
21337,11-3051.00,E2,E2,"A chat-only LLM can suggest generic cost-saving and productivity ideas, but fully optimizing a specific plant requires digesting large operational datasets and regulations, then generating tailored recommendations and tracking results—activities that need software integration with the plant’s data systems. An LLM-powered analytics tool that ingests those data and regulations and surfaces insights could cut the manager’s workload by ≥50%, but the LLM alone cannot."
21338,11-3051.00,E1,E2,"If the manager pastes or describes the key metrics, targets, and notable events (well under 2 000 words) into a chat, the LLM can draft the narrative, highlight trends, suggest interpretations, and polish the wording, cutting the time to produce an equivalent-quality operations-or efficiency report by well over half."
21339,11-3051.00,E0,E0,"While an LLM can draft guidance, performance-review templates, or suggested feedback, the core of supervising employees involves real-time observation, interpersonal interaction, and on-the-spot decision-making that require a manager’s physical presence and judgment; direct LLM access cannot cut the overall supervision effort by half."
3318,11-9021.00,E0,E2,"Verifying compliance requires the manager’s physical presence on-site to observe workmanship, measure clearances, test installations, and speak with crews. While an LLM could help interpret code language or generate checklists, the bulk of the task—the actual inspection and judgment in the field—cannot be off-loaded to text-based assistance and therefore the time required would not be halved."
3327,11-9021.00,E1,E2,"Designing a quality-control program is largely a writing and planning activity (procedures, checklists, inspection schedules, training materials). An LLM chat interface can rapidly draft these documents, suggest standards and metrics, and iterate on revisions, cutting the documentation and planning effort by well over half without extra software."
20332,11-9021.00,E2,E2,"A chat-only LLM can help draft schedules or emails, but real planning/coordination needs live project data, calendars, and specialty software; an LLM-powered tool integrated with those systems could easily cut the work time by half."
3326,11-9021.00,E1,E2,"An LLM can take cost figures and schedule data provided by the manager and quickly draft budget estimates, narrative progress reports, and cost-tracking summaries in the required format, cutting the time to produce these documents well beyond half without requiring additional specialized software."
20340,11-9021.00,E0,E0,"Effective supervision of on-site construction crews requires continuous in-person presence to observe work, enforce safety, coordinate equipment and trades, and respond to real-time issues. A chat-based LLM can help draft plans or messages, but it cannot meaningfully reduce by half the time spent physically directing and overseeing workers."
3317,11-9021.00,E1,E2,"Determining how many and what types of workers are needed is largely an exercise in reading the project schedule/scope, applying standard productivity rates, and producing a written plan; the LLM can perform the reasoning, simple calculations, and drafting of the dispatch plan from text inputs provided by the manager, cutting planning time well over half without extra specialized software."
3314,11-9021.00,E0,E0,"The core of this task is live, interpersonal discussion and negotiation with multiple stakeholders to solve real-time construction issues; while an LLM could help prepare notes or agendas, it cannot eliminate the need for these human interactions or reduce their duration by half."
20334,11-9021.00,E1,E2,"An LLM accessed through chat can quickly draft contract language, suggest alternative clauses, redline proposed changes, and generate negotiation emails or talking points, letting the manager prepare and revise agreements in far less time without additional specialized software."
3323,11-9021.00,E1,E2,"The manager can input the project’s written specifications into the chat and ask the LLM to analyze requirements and recommend suitable construction methods, materials, sequencing, and risk considerations; this textual guidance can cut the time spent interpreting specs and drafting a methods plan by well over half."
3315,11-9021.00,E2,E2,"While an LLM chat tool can help a construction manager draft schedules, safety plans, meeting notes, and emails, the core of the job—coordinating people and resources on-site, monitoring progress, and making real-time decisions—still requires substantial human involvement. However, a purpose-built application that combines the LLM with project-management data (schedules, budgets, change orders, field reports) could automate status summaries, flag risks, and draft updates, cutting overall planning/organizing time by about half. Thus the task is best classified as E2."
20339,11-9021.00,E0,E0,"Drafting scopes of work or contracts can be helped by an LLM, but the core of “contract or oversee craft work” involves in-person selection, negotiation, on-site supervision, and quality inspection of painters/plumbers—physical, real-time activities the model cannot perform or halve in duration."
20333,11-9021.00,E0,E2,"The core work—physically visiting the site, observing conditions, interviewing personnel, and making on-the-spot judgments—cannot be replaced or cut in half by an LLM; the model could only help with ancillary report writing, which is a minor portion of the task."
20336,11-9021.00,E3,E1,"A large portion of “plans” are visual construction drawings whose details must be interpreted before they can be explained. An LLM with text-only access could help summarize contract language, but the manager would still spend substantial time manually reviewing and translating the drawings. With image capabilities that let the LLM read and reason over blueprints and diagrams, the model could quickly extract key dimensions, materials, and sequencing details and draft audience-appropriate explanations, cutting the overall effort by more than half."
20335,11-9021.00,E0,E2,"The core of this activity is on-site assessment and physical coordination of crews, materials, and safety procedures in real time; an LLM can suggest contingency plans but cannot carry out or materially speed up the hands-on implementation, so overall task time would not be cut in half."
3325,11-9021.00,E2,E2,"Drafting the paperwork itself is just one part of requisitioning; doing it well also requires current pricing, vendor availability, and integration with procurement or inventory systems—information a stand-alone chat LLM cannot access. However, it is easy to imagine software built on top of the LLM that connects to supplier databases, pricing feeds, and inventory records, then auto-generates and submits requisition orders, cutting the manager’s time by more than half."
20337,11-9021.00,E2,E2,"A standalone chat LLM can help draft answers and explain requirements, but actually securing building permits involves locating jurisdiction-specific rules, populating government web forms, uploading plans and tracking approvals—steps that need integration with external portals. Specialized software built on top of an LLM could ingest project details, fetch local code requirements, auto-fill and file the correct electronic forms, and monitor status, thereby cutting the manager’s permitting workload by more than half."
19523,11-9021.00,E2,E2,"LLM alone can draft narrative sections or advise on methodology but lacks access to cost-database figures, site data, and simulation tools needed for accurate pre-building and sustainability assessments. However, a purpose-built tool that combines an LLM with those external datasets and calculators could automate much of the estimating and feasibility analysis, cutting the manager’s time by more than half."
20338,11-9021.00,E2,E2,"An LLM chat alone can help draft qualitative analyses, but accurate cost-effectiveness evaluation depends on structured quantity-takeoff data, BIM models, and cost-estimation software that the model cannot access directly. However, it is easy to imagine an LLM-enhanced tool that ingests those models, runs the calculations, and lets the manager ask natural-language questions to compare construction methods, cutting overall effort by more than half."
19522,11-9021.00,E2,E2,"Physical site inspections are essential, so chat-only access to an LLM cannot by itself cut the work time in half. However, an application built on top of the LLM that ingests plans, permits, photo logs, sensor data, and current environmental regulations could automatically flag potential non-compliance and generate checklists, cutting the review/ documentation portion of the task by more than half while the manager still performs the on-site checks."
19520,11-9021.00,E2,E2,"An LLM alone can help draft policies and training materials, but effective development and implementation of site-specific environmental programs also requires pulling current regulations, project data, and monitoring results and coordinating field actions. Purpose-built software that combines real-time data/regulation retrieval and LLM text generation could cut the overall effort by half, whereas chat access alone is insufficient."
19524,11-9021.00,E2,E2,"The manager must collect wide-ranging project evidence, match it to specific LEED credit requirements, and interface with external certifiers. A standalone chat-based LLM can help draft narratives and checklists, but much of the effort lies in locating, organizing, and uploading multiple project files and forms—work not halved by text assistance alone. However, it is easy to imagine LLM-powered project-management software that ingests drawings, specs, and logs, auto-maps them to LEED credits, drafts submittals, and tracks verification status, cutting the time by over 50 %."
19521,11-9021.00,E1,E2,"An LLM can rapidly research green-building best practices, draft curricula, slides, handouts, quizzes, and rollout communications, so the text-heavy design and documentation phase of the training program can be done in well under half the usual time; only the on-site delivery still needs the manager’s direct effort."
19519,11-9021.00,E1,E2,"With relevant cost figures and assumptions provided in the prompt, an LLM can quickly generate side-by-side budget tables, life-cycle cost analyses, and narrative justifications comparing green vs. conventional construction, cutting the drafting, formatting, and explanatory writing time by well over half; no special external software or image capability is required."
19518,11-9021.00,E1,E2,"Selecting and documenting green-building methods is primarily an information-gathering and writing task. A chat-based LLM can instantly synthesize codes, best practices, and material comparisons, draft guidelines, and generate checklists, reducing the research and planning time for the construction manager by well over half; the remaining on-site execution is outside the LLM’s scope but is not the core of this task description."
3331,11-9021.00,E2,E0,"Choosing and purchasing land involves research in property databases, drafting offers, and legal due-diligence as well as onsite visits and negotiations. A chat LLM alone can’t cut the overall time by half, but software built on top of the LLM that integrates real-estate listings, title records, zoning codes, and template contracts could streamline the research and document-prep portions enough to halve total effort, while the manager still handles in-person steps."
7263,11-9161.00,E0,E2,"The core of this task is real-time, interpersonal consultation with multiple external stakeholders (government, schools, hospitals, etc.) to assess their specific needs and capabilities. Success depends on relationship building, live discussion, trust, and situational judgment that must occur face-to-face or over synchronous calls. While an LLM could draft agendas or summarize notes, those ancillary text tasks represent far less than half of the total effort, so access to the model would not cut overall task time by 50 % or more."
7258,11-9161.00,E0,E0,"Building and sustaining inter-agency relationships chiefly relies on ongoing personal interactions—meetings, calls, trust-building, and negotiation—which cannot be automated or reduced by half through text-only LLM assistance; drafting messages is only a small fraction of the work."
7257,11-9161.00,E2,E2,"An LLM in a chat window can help draft communications and plans but cannot by itself run on-the-ground disaster operations. However, an application built on top of the LLM that ingests real-time incident data, auto-generates situation reports, recommended evacuation orders, and shelter status summaries could cut coordination time in half, so the task is exposure-prone through added software rather than direct chat use."
7260,11-9161.00,E1,E2,"If the director supplies bullet-point updates or raw field notes, a chat-based LLM can instantly organize, phrase, and format them into a clear situation status report covering response actions, recovery progress, resource needs, and preliminary damage estimates—cutting the manual writing and structuring time by well over half."
7256,11-9161.00,E1,E2,"Maintaining and updating emergency-preparedness resource documents is largely a text-editing, rewriting, and summarization job. If the director supplies the new data (e.g., updated contacts, inventories, procedures) in text form, an LLM can rapidly integrate those details, rewrite sections, generate revised versions, and check consistency, cutting the time required by well over half without any specialized software beyond the chat interface."
7254,11-9161.00,E1,E2,"Creating emergency-response plans is largely a writing and document-structuring task; with the relevant context provided (hazards, available resources, applicable regulations), an LLM can draft detailed operating procedures, outlines, and checklists that the director can review and tailor, cutting the overall planning and writing time by more than half without needing additional software."
7264,11-9161.00,E2,E2,"Drafting plans and evaluation checklists can be speed-up with a chat LLM, but running and assessing drills requires coordination and field work that the model alone can’t streamline enough; purpose-built software that embeds the LLM with regulatory databases, scheduling tools, and automated reporting could plausibly cut total effort by half."
7266,11-9161.00,E2,E2,"Writing the actual narrative of a damage assessment and doing first-pass analyses of the numbers can be sped up by an LLM, but most time is spent collecting field data and coordinating with multiple agencies—activities that still require human interaction. Purpose-built software that pipes field reports, images, and sensor data into an LLM for automatic summarization and templated reporting could plausibly cut total task time in half, but the bare chat interface alone would not."
7261,11-9161.00,E1,E2,"The core of the task—creating course outlines, lesson plans, scenarios, hand-outs, assessments, and related communications—is largely text-based. A chat-based LLM can quickly draft, revise, and tailor all these materials and produce administrative documents (schedules, email templates, evaluation forms), cutting preparation time well over half, even though final delivery/logistics still require human action."
7253,11-9161.00,E2,E2,"The core of this task is continuous monitoring of many external information sources (news, weather feeds, agency reports, social media, etc.). An LLM chat alone cannot pull or refresh these real-time data streams, so it would not halve the effort. But building a software layer on top of an LLM that automatically ingests and summarizes those live sources, flags relevant changes, and answers follow-up questions would greatly cut the director’s monitoring time; therefore it fits E2."
7262,11-9161.00,E0,E0,"The core of the task is an in-person, hands-on inspection of physical facilities and communications hardware to judge their readiness; an LLM (even with image tools) cannot substitute for being on-site, operating devices, or verifying functionality, so it would not cut the required human time by half."
7269,11-9161.00,E1,E2,"By pasting sections of the emergency plan (or the whole plan if it fits the 2 000-word limit) together with the relevant evaluation criteria into the chat, the LLM can rapidly highlight gaps, check compliance with standards, suggest revisions, and draft feedback notes. This replaces much of the director’s manual reading, cross-referencing, and writing, easily cutting the required time by more than half without any special software beyond the chat interface."
7259,11-9161.00,E2,E2,"An LLM by itself lacks access to the continually changing federal, state, and local regulations the director must track, but a specialized application that combines real-time regulatory databases with the LLM’s summarization and compliance-checking abilities could quickly surface updates and flag plan gaps, cutting the effort well over half."
7270,11-9161.00,E2,E2,"An LLM can quickly help write questionnaires, suggest sampling frames, and interpret open-ended responses, but the physical/organizational work of actually distributing surveys and following up with respondents still takes significant time. With a purpose-built tool that pairs the LLM with online survey and analytics platforms, much of the design, deployment, and analysis cycle could be automated, cutting overall effort by at least half."
7265,11-9161.00,E0,E0,"The core of the task is physically (or at least synchronously) attending events and building human relationships; these interactive, real-time activities cannot be substantially shortened—let alone cut in half—simply by consulting an LLM."
7255,11-9161.00,E2,E2,"Drafting new procedures requires reviewing lengthy regulations, technological documentation, and prior incident reports that usually exceed the 2,000-word limit and may need up-to-date information. An LLM-powered tool that can ingest large documents, pull current regulations, and summarize lessons learned could cut the work time in half, but simple chat access alone is unlikely to do so."
7267,11-9161.00,E1,E2,"An LLM can quickly draft brochures, slide decks, talking points, and FAQs explaining emergency plans, letting the director refine and deliver them; this direct text-generation support cuts preparation time well beyond half even though the actual in-person presentation still requires the human."
