task_id,soc_code,label,eloundou_label,explanation
6391,25-1126.00,E0,E0,"Committee service is fundamentally an interpersonal, real-time activity that requires live discussion, deliberation, and voting; while an LLM might help draft documents or summaries, it cannot eliminate the need for the instructor’s active participation, so access to the model would not cut the task time in half."
6395,25-1126.00,E1,E2,"Much of recruiting, registration, and placement assistance involves drafting emails, answering student questions, preparing promotional or advising materials, and creating or revising documents and forms—activities dominated by text creation and transformation. A chat-based LLM can rapidly generate, personalize, and refine these materials and scripted responses, cutting the educator’s writing and information-provision workload well beyond half, while the remaining face-to-face or system-entry steps still require the teacher."
6394,25-1126.00,E1,E1,"An LLM can quickly generate and format lists of relevant philosophical or religious sources once given parameters (topic, level, length, etc.), cutting the instructor’s manual searching and citation-formatting time by well over half."
6393,25-1126.00,E0,E0,"The core of “participate in campus and community events” requires the instructor’s real-time presence, social interaction, and physical attendance; an LLM can help draft remarks or publicity but cannot replace or cut in-person participation time by half."
6397,25-1126.00,E0,E0,"Advising student organizations mainly entails real-time, relationship-based interaction—meeting with students, attending events, signing off on activities, and serving as the official faculty presence required by university rules. An LLM can help draft emails or documents, but these writing tasks form only a small share of the adviser’s total responsibility, so chat access would not cut the overall time commitment by half."
6398,25-1126.00,E1,E1,"Crafting a grant proposal is primarily a writing task: outlining objectives, significance, methodology, timeline, and budget justification in persuasive prose. An LLM can quickly generate drafts, suggest structure, refine language, and incorporate reviewer-oriented framing from user prompts, cutting the human professor’s drafting and editing time well beyond half without needing additional specialized software or image capabilities."
6673,25-2032.00,E2,E0,"Live instruction still requires a human teacher, so a basic chat with an LLM would not cut teaching time in half. However, it is easy to imagine classroom software built on top of the LLM that can run interactive lessons, give demonstrations, and answer student questions autonomously, letting the teacher supervise rather than deliver every lecture and discussion, thereby reducing the teacher’s direct instructional time by roughly half."
6674,25-2032.00,E0,E0,"Drafting written classroom rules is only a small fraction of this work; the core activity—real-time monitoring of students, issuing verbal redirections, applying consequences, and maintaining classroom presence—requires continuous, in-person interaction that an LLM cannot perform, so access to the model would not cut the task time in half."
6671,25-2032.00,E0,E0,"Preparing a classroom involves physically arranging furniture, equipment, and supplies and distributing printed or hands-on materials; an LLM can help plan or draft worksheets but cannot perform the bulk of the required physical setup, so it cannot cut the total task time by half."
6675,25-2032.00,E0,E0,"Requires in-person, real-time observation of students’ conduct, social interaction, and physical condition. An LLM can help write reports, but it cannot perform or meaningfully shorten the essential classroom observation itself, so overall time savings would be <50 %."
6681,25-2032.00,E2,E2,"A chat-only LLM cannot by itself replace the in-person lecturing, classroom discussions, hands-on shop/lab supervision, and field studies that make up most of a technical-education teacher’s time. However, purpose-built software on top of an LLM could auto-generate lesson plans, slide decks, quizzes, grading rubrics, and interactive practice modules, as well as provide on-demand tutoring for students. Such tools could plausibly cut the teacher’s preparation and repetitive instructional workload by more than half while the teacher still handles the physical and interpersonal components."
6676,25-2032.00,E0,E0,"Physical, real-time supervision and safety monitoring of students using equipment must be done in person; while an LLM could draft written guidelines, it cannot handle the core in-class monitoring, so access to it would not halve the time required."
6682,25-2032.00,E1,E1,"An LLM can rapidly draft lesson, unit, and project objectives aligned to standards and suggest clear, student-friendly wording, cutting the teacher’s planning and writing time by well over half; the teacher still delivers them, but formulation/communication materials are largely text-based and easily produced via chat."
6683,25-2032.00,E0,E2,"The essence of this task is the physical setup and real-time operation of computers, projectors, speakers, lab gear, etc., during classroom instruction. An LLM could suggest content, but it cannot handle or configure the equipment; the teacher must still do nearly all the work, so task time would not be halved."
6688,25-2032.00,E0,E0,"Effective guidance and counseling depend primarily on real-time, empathetic, face-to-face interaction with students. While an LLM could draft resources or suggested talking points, it cannot replace the core in-person relationship-building and individualized support, so access to the model would not cut the required time by half."
6672,25-2032.00,E2,E1,"A chat-only LLM cannot directly enter grades, attendance, and compliance data into the school’s student-information system, so it would not by itself cut the record-keeping time in half. However, it is easy to imagine an application built on top of an LLM that extracts data from assignments, summarizes student progress, and auto-fills the required electronic forms, letting the teacher simply review and approve, which would reduce the task time by at least 50 %."
6677,25-2032.00,E0,E2,"An LLM can draft lesson plans and activity ideas, but the bulk of this task is live classroom execution—demonstrating equipment, supervising student work, answering questions in real time, ensuring safety—that requires the teacher’s physical presence. Even if the planning portion were sped up, it represents far less than half of the overall time, so total task time would not be cut by 50 % or more."
6678,25-2032.00,E1,E2,"A chat-based LLM can quickly generate test questions, rubrics, and answer keys, and teachers can paste student answers or essays into the chat to receive scores and feedback, cutting the preparation and grading workload by well over half without any extra software beyond the chat interface."
6680,25-2032.00,E2,E2,"An LLM chat window can help a teacher draft assignments and give feedback on individual written submissions, but grading an entire class’s mixed text-and-practical work efficiently would require an integrated tool that ingests batches of student files, applies rubrics automatically, and handles non-text artifacts. Such an LLM-powered application could cut grading/assignment time by half, whereas raw chat access alone is unlikely to do so for this role."
6679,25-2032.00,E0,E0,"Enforcing policies requires real-time, in-person supervision, judgment, and physical presence with students; an LLM interface cannot meaningfully reduce the time or effort needed to carry out this classroom management duty."
6703,25-2032.00,E0,E0,"The core activity involves physically supplying devices, setting them up, and personally helping students navigate school facilities; these hands-on, in-person duties cannot be substantially shortened by a text-only LLM."
6685,25-2032.00,E0,E2,"The core of this task is ongoing, in-person motivation and relationship-building with students—activity that cannot be meaningfully automated or cut in half merely through text generation or other software assistance."
6695,25-2032.00,E0,E0,"An LLM can draft lesson plans, permission forms, and reflection questions, but the core of the task—physically supervising students on projects, field trips, and guest-speaker sessions and guiding their real-time learning—must still be done in person. Because that in-person component takes a large share of the total time, access to the LLM cannot cut total task time by half."
6686,25-2032.00,E0,E0,"Although an LLM could help a teacher draft emails or talking points, the core of this task is live, interpersonal discussion and collaborative problem-solving with parents, colleagues, and administrators—activities that still require real-time human interaction. Access to the LLM would not cut the overall time for these meetings and negotiations by half or more while maintaining quality."
6690,25-2032.00,E1,E2,"A teacher can ask the LLM for concise overviews of current instructional and subject-area trends and have it rapidly summarize or explain any articles or reports they paste into the chat, reducing the time spent scanning and digesting sources by well over half without needing extra software."
6684,25-2032.00,E0,E0,"While an LLM could draft documents or communication templates, the core of this duty requires in-person coordination with businesses, on-site oversight of students, and ensuring safety in shops and labs—activities that a text-only tool cannot perform. Since most of the time is spent on physical supervision and real-time interaction, access to an LLM would not cut the total task time by half."
6691,25-2032.00,E0,E0,"The core of this task is live, interpersonal discussion and collaborative decision-making with colleagues about specific students; even with LLM-generated prep materials, the professionals still need to meet and talk, so direct or indirect LLM use would not cut the required meeting time by half."
6692,25-2032.00,E2,E2,"An LLM can quickly draft individualized remedial lesson plans, worksheets, and assessments, but actually delivering those remedial lessons to students still requires significant in-person interaction. With additional LLM-powered software (e.g., adaptive tutoring platforms that present and grade material automatically), the overall time to both prepare and implement a remedial program could be cut by more than half, so the task fits E2 rather than E1."
6687,25-2032.00,E1,E1,"Given curriculum guidelines, a teacher can prompt the LLM to draft learning objectives and a course outline, iterate on wording and alignment to standards, and quickly refine the documents, cutting preparation time by well over half."
6694,25-2032.00,E0,E0,"The core of the task is holding a live, interactive meeting with parents or guardians—an inherently human‐to‐human activity that the teacher must perform in real time. While an LLM might help draft notes or talking points, the bulk of the time is spent in conversation, which the model cannot conduct for the teacher, so overall time savings would be far less than 50 %."
6699,25-2032.00,E2,E2,"A stand-alone chat LLM can help draft referral letters or emails but cannot on its own search live job openings or coordinate with employers, which are the time-consuming parts of placing students. However, it is easy to imagine (and many products already exist) that layer an LLM on top of job-search databases and applicant-tracking systems to auto-match students to openings and generate referral packets, cutting the teacher’s effort by more than half."
6689,25-2032.00,E0,E2,"The core work—physically selecting items, moving and storing them, issuing them to students, and counting inventory—requires hands-on effort in the classroom. An LLM could draft shopping lists or forms, but that is a small share of the total time, so overall time would not be cut in half."
6697,25-2032.00,E0,E0,"Sponsoring clubs or contests requires the teacher’s in-person supervision, relationship-building, and real-time management of students; an LLM could only assist marginally with planning materials, so it would not cut the required time by half."
6698,25-2032.00,E1,E2,"An LLM can quickly draft curriculum outlines, suggest program revisions aligned with standards, generate evaluation rubrics, and summarize peer feedback, cutting in half the time needed to prepare the documents teachers and administrators discuss when collaborating on program development or revision."
6696,25-2032.00,E0,E1,"This duty centers on a teacher’s physical or live virtual presence at meetings, conferences, and workshops for professional development and networking. An LLM cannot substitute for attendance requirements or interpersonal interaction, and its text-based assistance would not reduce the time spent at such events by half."
6700,25-2032.00,E1,E2,"An LLM can instantly draft lesson plans and proposed schedules aligned with the approved curriculum, summarize standards, and suggest pacing guides. Having these materials ready before meeting with colleagues cuts the preparation and planning time well beyond half; only the final human discussion remains."
6693,25-2032.00,E1,E1,"Drafting narrative or tabular reports about student performance or classroom activities is a text-generation task. A teacher can feed the LLM basic data or bullet notes and receive polished, administration-ready reports in minutes, cutting effort well over half without any extra software beyond the chat interface."
6701,25-2032.00,E0,E0,"The core activity—being physically or virtually present, listening, speaking, and voting in staff meetings or committee sessions—cannot be outsourced to an LLM. While an LLM could help draft documents or summaries, the teacher must still attend and participate, so overall time savings would be less than half."
6702,25-2032.00,E0,E0,"Duties like monitoring halls or cafeterias, helping in the library, and supervising bus loading all require an on-site human presence and physical interaction; an LLM chat tool cannot meaningfully reduce the time needed for these tasks."
7631,25-4011.00,E2,E2,"While an LLM can help an archivist brainstorm taxonomies or draft classification guidelines in a chat window, achieving a 50 % time-savings for the full job of organizing large collections typically requires software that can ingest many documents, extract metadata, suggest subject tags at scale, and integrate with archive-management systems—capabilities that go beyond a simple chat interface but are straightforward to build on top of an LLM."
7633,25-4011.00,E2,E2,"An LLM by itself can suggest search terms or draft responses, but it has no direct access to the archive’s catalog or finding aids, so it is unlikely to cut reference-service time by half. However, an application that couples the LLM with internal catalog/search APIs and document summarization could quickly surface and describe relevant archival materials, easily halving the effort."
7635,25-4011.00,E1,E1,"An archivist can supply the LLM with each document (or its key excerpts) and have the model draft standardized descriptions, subject headings, and metadata fields. Generating, editing, and formatting these records via chat reduces the human reading-and-writing effort by well over half without needing extra software beyond the basic LLM interface."
7630,25-4011.00,E1,E2,"A chat-based LLM can quickly draft database schemas, generate metadata standards, write ingest/backup scripts, compare storage technologies, and produce the documentation and policies needed for a digital archive. These text-heavy design, coding, and planning components constitute a large share of the archivist’s effort, and the LLM’s assistance can cut that portion of work well beyond half without requiring extra software beyond the chat interface."
7637,25-4011.00,E1,E2,"Crafting and updating access policies is largely a text-generation and revision task (researching regulations, benchmarking, drafting guidelines, producing FAQs). A chat-based LLM can generate, refine, and summarize this material far faster than an archivist writing from scratch, reducing effort by well over half without extra tooling."
7634,25-4011.00,E0,E2,"Supervising and coordinating the day-to-day, in-person work of staff handling physical collections is fundamentally a human, situational activity; an LLM can draft written guidelines or advice but cannot meaningfully replace or halve the time spent on real-time direction, problem-solving, and interpersonal management."
7636,25-4011.00,E0,E2,"The core work involves physically handling records and operating specialized hardware to reformat materials (film scanners, audio-video transfer decks, etc.). An LLM can offer guidance but cannot perform or halve the time of the manual, equipment-based preservation tasks."
7639,25-4011.00,E2,E2,"Accurately determining provenance usually requires consulting many external records and databases; an LLM interface alone cannot fetch those sources, but an application that pairs the LLM with search over digitized collections and reference databases could quickly surface relevant information and draft significance notes, cutting the archivist’s effort by half."
7638,25-4011.00,E2,E2,"A chat-only LLM cannot browse real-time auction sites, donor lists, or collection databases, so it would not on its own cut the archivist’s time in half. However, software that continuously gathers those external sources and feeds them to the model could let the LLM shortlist promising materials, draft acquisition emails, and generate exhibit plans, significantly reducing the time needed to locate, acquire, and prepare items for display."
7632,25-4011.00,E0,E2,"Determining authenticity and value of historical documents depends mainly on direct physical examination (paper, ink, watermarks, condition) and specialized testing; while the LLM could help draft write-ups or summarize background research, it cannot perform or significantly speed the core hands-on inspection, so overall task time would not be reduced by half."
7641,25-4011.00,E1,E0,"Much of “coordinating” tours, workshops, lectures, and classes is preparing written material—agendas, lesson plans, promotional blurbs, email invitations, follow-up notes, schedules, and speaker briefs. A chat-based LLM can draft, revise, and adapt all of this text quickly, letting the archivist keep only the final approval and logistical clicks, so the total planning time can be cut by more than half without any extra bespoke software."
7640,25-4011.00,E2,E2,"An LLM-powered application that can search institutional catalogs, external databases, and recent scholarship, then summarize relevance and recommend items would cut research and decision-making time by half; using the raw chat interface alone, without automated retrieval of those materials, would not consistently achieve that reduction."
7642,25-4011.00,E1,E2,"The work is mainly text-based (reviewing candidate documents, suggesting edits, drafting explanatory notes and captions). A chat-based LLM can quickly evaluate each document’s subject relevance and literary quality, propose edits, and draft display text, cutting the archivist’s reading-and-writing time by well over half without requiring extra software or image capabilities."
1764,27-3031.00,E1,E2,"An LLM can quickly draft press responses and recommend suitable spokespeople when provided with organizational context, cutting the PR specialist’s writing and decision-making time by well over half, with the human simply reviewing and approving the output."
20555,27-3031.00,E1,E2,"The LLM can quickly generate strategic communication plans, audience analyses, key messages, press releases, social-media calendars, FAQs, and other collateral, giving the PR specialist ready-made drafts and ideas that cut the planning and content-creation time well beyond half; actual execution and stakeholder coordination still require the human, but the core planning/communication work is substantially accelerated through direct chat use."
23951,27-3031.00,E1,E1,"An LLM can rapidly draft, rewrite, and tailor web and social-media copy, generate headlines, captions, and hashtags, and adapt tone or length on request, so the specialist mainly just copies the text into the CMS—reducing the overall time required by well over half without additional software."
20554,27-3031.00,E1,E1,"Drafting and editing press releases is a text-generation task; an LLM can quickly create, revise, and polish the required media communications, cutting the human’s writing time by well over half when used directly through a chat interface."
1765,27-3031.00,E0,E0,"Building and sustaining real-world relationships with external groups depends primarily on ongoing human interaction, meetings, and trust-building; an LLM can help draft messages but cannot eliminate or reduce by half the time spent on these interpersonal activities."
1770,27-3031.00,E2,E2,"A chat-only LLM can help prepare talking points or draft analyses, but most of the effort involves live discussion with other managers, which it cannot directly shorten by 50 %. Purpose-built software that mines internal data, flags emerging trends, and supplies real-time meeting summaries or suggested responses could plausibly halve the time needed, so the task is exposed mainly through LLM-powered applications rather than direct use."
1772,27-3031.00,E1,E2,"An LLM can quickly draft talking points, refine messaging, simulate interview Q&As, and generate feedback on sample statements, letting the PR specialist prepare training materials and run text-based practice sessions far faster—reducing prep and coaching time by well over half without extra software."
1769,27-3031.00,E1,E2,"Given a summary of the organization’s objectives and policies (≤ 2000 words), an LLM can quickly analyze them, generate messaging frameworks, audience segmentation, channel plans, and draft a full public-relations strategy, cutting the human’s writing and ideation time by well over half."
20557,27-3031.00,E1,E1,"Preparing or editing newsletters or reports is primarily a writing, rewriting, and proofreading activity; an LLM can quickly draft, revise, and polish these publications from prompts or existing text, cutting the required human time by well over half."
1768,27-3031.00,E2,E2,"A chat-only LLM can help draft pitches, emails, and agendas, but arranging real-world appearances still depends on finding up-to-date venues, checking calendars, booking logistics, and coordinating with many parties. Software built on top of the LLM that can pull live event data, integrate calendars, and send/track outreach could halve the effort, whereas the bare LLM alone would not."
1775,27-3031.00,E2,E2,"The LLM can draft research plans, survey instruments, and presentation text, but actually running the study (recruiting respondents, collecting & crunching numerical data) still needs external tools and integrations. Purpose-built LLM software that plugs into survey panels, data pipelines, and BI dashboards could halve overall effort, but the bare chat interface alone is unlikely to."
19811,27-3031.00,E1,E2,"An LLM can quickly generate messaging frameworks, campaign outlines, press releases, and social-media copy about sustainability, safety, or social issues, letting a PR specialist iterate and refine rather than draft everything from scratch—easily cutting the required time by more than half."
1767,27-3031.00,E2,E2,"An LLM alone can help draft briefs or talking points, but the core of the task is live coordination with other people. However, software built on top of an LLM—e.g., tools that automatically generate production timelines, summarize meetings, track action items, and propose advertising assets—could plausibly cut coordination time by at least half."
1771,27-3031.00,E2,E2,"While an LLM can draft briefs, brainstorm campaign ideas, and suggest media mixes, the core of the task—negotiating and coordinating with agency personnel across multiple media channels—still requires substantial human interaction. However, a purpose-built tool that layers scheduling, media-buy data, and real-time collaboration features on top of an LLM could streamline planning and communication enough to cut the total effort by at least half."
1773,27-3031.00,E1,E1,"An LLM can rapidly draft, edit, and tailor speeches to the organization’s messaging goals, reducing the preparation portion of the task by well over half; the human still delivers the speech, but content creation is the core time-consuming step."
19809,27-3031.00,E1,E2,"An LLM accessed through chat can rapidly draft press releases, Q&As, talking points, social-media posts, and overall messaging strategy for an environmental incident, and can refine wording in real time, cutting the writing and planning effort by well over half; while actual stakeholder outreach still needs a human, the core text-based coordination work is greatly accelerated."
19810,27-3031.00,E1,E2,"Creating campaign concepts, slogans, messaging, target-audience profiles, and promotional copy is a text-generation/iteration activity the LLM can perform directly; the PR specialist can refine the output, so access to the model cuts the work time by well over half without extra software."
