task_id,soc_code,label,eloundou_label,explanation
2640,43-4111.00,E0,E0,"The core activity is a daily, real-time exchange with a supervisor to hand over work and talk through progress—an interaction that must still happen person-to-person. While an LLM might help craft a brief summary, it can’t remove the need for the meeting itself, so it wouldn’t cut the task time by half."
2638,43-4111.00,E2,E2,"Compiling current address lists requires querying mapping/utility databases or other external sources; a standalone chat LLM lacks that access, but software built on top of the LLM that pulls those records and lets the model clean, deduplicate, and format them could easily halve the effort compared with manual searching and entry."
2631,43-4111.00,E2,E0,"Simply having chat access to an LLM won’t cut the time of phoning, mailing, or visiting people in half—the worker still has to perform the outreach. But it’s straightforward to envision LLM-powered calling or messaging systems that auto-dial, generate personalized scripts/emails, and handle initial voice or text interactions, which would substantially reduce manual contact effort."
2641,43-4111.00,E2,E2,"Direct chat access to an LLM would help only with the textual analysis portion of the job; most time is still spent physically locating records or conducting face-to-face census interviews. However, it is easy to envision software built on top of the LLM (e.g., OCR tools that extract data from paper records, mobile apps that transcribe and auto-tally interview responses) that could automate large parts of both data-capture and analysis, cutting total task time by at least half."
2635,43-4111.00,E2,E1,"The main value would come from a purpose-built LLM chatbot that interacts with respondents in real time, automatically explaining the survey and clarifying questions; this could cut the human interviewer’s effort by more than half, whereas simply having raw access to the LLM chat interface would not."
2816,43-9031.00,E3,E2,"Page layout and production are fundamentally visual tasks. A plain-text LLM cannot by itself arrange graphics, choose fonts, or position elements on a page, so direct chat use would not halve the work. However, with an LLM coupled to image-creation/inspection tools, the system could generate and modify page proofs, export print-ready PDFs, and automate much of the desktop-publishing workflow, cutting the required time by more than half."
2820,43-9031.00,E1,E2,"A chat-based LLM can instantly propose page templates, font pairings, color palettes, and even supply full HTML/CSS or InDesign scripting instructions that the user can paste into their publishing software, eliminating much of the manual trial-and-error involved in arranging text and art elements and thus cutting the work time by well over half."
2815,43-9031.00,E3,E1,"Proofs usually must be examined not only for textual mistakes but also for visual/layout issues (margins, kerning, image placement, widows-and-orphans, etc.). An LLM with image-reading and PDF-viewing abilities could rapidly scan the pages, spot both textual and formatting errors, and suggest corrections, cutting the task time by well over half. A text-only LLM would miss many layout problems, so the big efficiency gain relies on combined text-and-image capabilities."
2817,43-9031.00,E0,E2,"The core of the task is the human visually monitoring on-screen layouts and immediately tweaking design elements; this depends on real-time visual judgment and interaction with desktop-publishing software. A text-only LLM cannot see the screen or make live visual adjustments, and even with generic LLM image tools the worker would still need to watch and decide, so the model would not cut the required time in half."
2818,43-9031.00,E2,E1,"A chat-only LLM can suggest wording and give style advice, but the worker still has to lay out text manually in publishing software. However, it is straightforward to imagine an LLM-driven plug-in that inserts the text and applies fonts, column widths, and spacing automatically, cutting the work time by more than half."
2824,43-9031.00,E1,E2,"A chat-based LLM can produce formatted layout code or templates (e.g., HTML/CSS, LaTeX, or InDesign/Quark scripts) from a textual description almost instantly; the worker can import this into the desktop-publishing program and make minor tweaks, cutting the time to create sample layouts by well over half."
2823,43-9031.00,E1,E2,"Importing text and image files is a purely software task; an LLM can supply step-by-step instructions or generate InDesign/Quark scripts/macros to batch-place the assets, so direct chat access can cut the manual setup work by well over half."
2825,43-9031.00,E1,E1,"The instructions can be pasted (or briefly described) to the LLM; it can then analyze them and draft a clear list of required tasks and their optimal order, cutting the human’s planning/interpretation time by well over half."
2829,43-9031.00,E3,E2,"To decide how many inks are required and which plates to output, the worker normally inspects the actual page files or proofs. If the LLM can directly “look at” those PDFs/images, extract the palette, spot colors, overprints, etc., it can instantly recommend the optimal number of colors and the needed separations, cutting the manual analysis time by well over half. A text-only chat interface would not give that savings, but an image-enabled LLM would."
2827,43-9031.00,E1,E1,"A chat-based LLM can supply the exact command lines, scripts, or step-by-step menu instructions needed to export or batch-convert documents (e.g., InDesign → PDF, Word → HTML) and advise on print/web settings, letting the worker execute the conversions far faster and with fewer errors—often cutting the required effort by more than half without requiring new software beyond the LLM’s text guidance."
2821,43-9031.00,E0,E2,"The core activity is physically operating a scanner, camera, keyboard, or mouse to load files into a prepress system. This hands-on data-entry work is hardware-bound; having an LLM chat assistant would not meaningfully shorten the time required, since the worker still must handle the equipment and perform the uploads manually."
2822,43-9031.00,E3,E2,"Image-editing work could be greatly accelerated if the LLM is paired with software that can open, interpret, and manipulate images from text instructions—e.g., “remove blemishes, apply masking, adjust color levels.” Such multimodal tools would let a worker describe desired changes in words and get near-finished graphics back, at least halving the manual pixel/bitmap editing effort."
2828,43-9031.00,E3,E2,"The core activity is manipulating visual assets—entering image coordinates and color values so software can carry out retouching and color-correction. A text-only LLM cannot “see” or directly modify the images, so it can’t meaningfully shorten the hands-on data-entry portion. With an LLM that can view and edit images, however, the worker could simply describe the desired adjustments and let the system apply the coordinates and color specifications automatically, cutting the task time by more than half."
2830,43-9031.00,E0,E1,"The core activity is physically or digitally sending final publication files to a printer; this is a simple logistical action that is not meaningfully accelerated by a conversational LLM, nor would added LLM-based software appreciably reduce the time required."
2831,43-9031.00,E2,E2,"An LLM chat tool by itself can help draft emails or text, but it cannot directly lay out pages or combine images and typography inside InDesign/Quark; however, with modest extra software that links the LLM to desktop-publishing programs (or lets it read design specs and generate layout scripts/templates), the time needed to create master copies and iterate with collaborators could easily be cut in half."
2819,43-9031.00,E0,E1,"The activity primarily involves physically printing or copying files onto paper, magnetic tape, film, or diskettes and organizing that media. An LLM can only give verbal instructions and cannot perform or meaningfully speed up the necessary hands-on hardware steps, so access to it would not cut the task time in half."
2832,43-9031.00,E3,E2,"The core of this task is producing and manipulating visual media (vignettes, mosaics, image combining) and inserting those assets into electronic publications. A text-only LLM cannot directly edit or create images, so it would not cut the time in half. With an LLM paired to an image-generation/editing system, however, the worker could simply describe the desired effects and have them produced or tweaked automatically, greatly reducing manual work; hence it fits the E3 category."
2826,43-9031.00,E0,E0,Loading physical media like floppy disks or tapes requires manual insertion of the media into hardware; an LLM or related software cannot perform or meaningfully speed up this purely physical task.
23403,45-3031.00,E0,E0,Steering a vessel and manipulating navigational instruments are fundamentally physical activities that must be performed on-board; a text-only LLM cannot carry them out or cut the human’s hands-on time in half.
23410,45-3031.00,E0,E2,"The task is predominantly physical—removing fish or game from equipment and measuring them on site. An LLM cannot perform or meaningfully speed up these manual, hands-on activities."
23428,45-3031.00,E0,E0,"Directing fishing or hunting operations and supervising crew require in-person leadership, real-time decision-making on a vessel or in the field, and hands-on coordination; an LLM chat interface cannot meaningfully cut the time needed to perform these physical, location-dependent tasks."
23419,45-3031.00,E2,E0,"A chat-only LLM cannot see real-time weather or vessel sensor data, so on its own it cannot halve the effort. However, it is easy to imagine software that pipes current forecasts and onboard instrument readings into the LLM and has it output recommended actions, which would greatly speed interpretation for the worker."
23402,45-3031.00,E0,E0,The core activity is physically traveling to remote hunting areas using various modes of transport; no amount of text-based assistance can replace or halve the time needed for the actual physical movement.
23415,45-3031.00,E0,E0,"The core of the task is hands-on field work—physically selecting, baiting, and setting traps and laying poison in outdoor environments. While an LLM might give advice on trap choices, the time-consuming physical labor cannot be reduced by half through a chat interface alone."
23408,45-3031.00,E0,E0,"The core of the task is hands-on physical work—inspecting, maintaining, and repairing mechanical equipment on a vessel. While an LLM might offer troubleshooting tips, it cannot perform or significantly accelerate the physical repairs, so direct access does not cut task time by half."
23424,45-3031.00,E0,E0,"This is a hands-on, physical activity (attaching floats, weights, flags, lights, or markers to fishing gear). An LLM cannot perform or meaningfully speed up the manual labor involved, nor would additional LLM-based software halve the time needed."
23423,45-3031.00,E0,E0,"The task is a physical, hands-on cleaning activity that cannot be meaningfully accelerated by text‐based assistance from an LLM."
23427,45-3031.00,E0,E0,"The task is overwhelmingly physical—operating boats, traps, dredges, diving gear, etc.—and requires on-site manual labor. Direct access to an LLM cannot meaningfully reduce the time required to harvest marine life, nor could simple LLM-based software halve the effort for an average worker."
23429,45-3031.00,E2,E2,"A standalone chat LLM cannot access live vendor catalogs, pricing, or inventory systems, so it cannot by itself cut the time of supervising procurement by half; however, procurement software that layers an LLM on top of real-time supplier and inventory data could draft purchase orders, compare quotes, and flag shortages, greatly speeding the oversight process."
23426,45-3031.00,E0,E0,"The task is manual, physical labor (loading/unloading equipment and supplies). An LLM’s text-based assistance cannot substitute for or meaningfully speed up the required hands-on work."
23406,45-3031.00,E0,E0,"Scraping fat, blubber, or flesh from pelts is a purely manual, hands-on activity; access to an LLM can at most give written instructions but cannot materially speed up the physical work."
23400,45-3031.00,E0,E0,"The core of the task is physical fieldwork—traveling to trap sites, handling equipment, removing fish or game, and resetting or moving traps. An LLM can offer advice or planning tips, but it cannot meaningfully reduce the time required to carry out the manual labor itself."
23411,45-3031.00,E0,E0,"Locating fish requires operating and interpreting real-time sonar or other fish-finding hardware on a boat; direct or software-mediated access to a text-only LLM would not meaningfully replace or halve the physical, equipment-based effort involved."
23421,45-3031.00,E0,E0,The task is inherently physical—actually killing or stunning animals with weapons or other means—and cannot be materially sped up by text-based assistance from an LLM.
23405,45-3031.00,E0,E0,"Maintaining and repairing trapping equipment is a hands-on, physical activity; while an LLM could give advice or manuals, it cannot perform or substantially speed up the essential on-site mechanical work, so direct access to the model would not cut the task time by half."
23401,45-3031.00,E2,E0,"An LLM alone can draft outreach letters or call scripts, but actually obtaining permission still involves locating owners, tracking responses, and possible back-and-forth negotiation. It is easy to imagine software built on top of the LLM that automates bulk owner lookup, message generation, follow-up scheduling, and even chat-based negotiation, cutting the hunter’s active effort by more than half."
23407,45-3031.00,E0,E0,"This task is a hands-on, physical activity (deploying and towing fishing gear) that cannot be meaningfully accelerated simply by consulting an LLM through text; the time is dominated by manual labor and on-site execution."
23414,45-3031.00,E1,E2,"The worker can type sextant angles, compass bearings, speed and time data into the chat; the LLM can instantly perform the sight-reduction math and generate the recommended track, cutting the manual computation and course-planning effort by well over half. Physical plotting on the chart still happens, but the calculation portion is dramatically shortened with no extra software needed."
23409,45-3031.00,E0,E0,"This task is entirely hands-on manual labor (physically sorting, packing, and storing the catch with salt and ice). An LLM, even with added software or image capabilities, cannot perform or halve the time required for the physical work involved."
23412,45-3031.00,E2,E0,"While a chat-based LLM can help draft letters or signage, most time is spent figuring out which permits are needed, locating the right government forms, filling them with precise site data, and tracking who must be notified. A purpose-built LLM application that automatically pulls the latest wildlife-agency rules, pre-populates approval forms, and generates personalized notices for all residents near trap sites could cut this administrative workload by well over half, but the raw chat interface alone would not."
23413,45-3031.00,E0,E0,"Locating and following animals in the field demands physical presence, observation, and movement through terrain; an LLM cannot replace or halve the time needed for these hands-on tracking activities."
23404,45-3031.00,E0,E0,The task is entirely manual and physical—skinning animals with knives and stretching pelts on frames. An LLM interface cannot perform or meaningfully speed up this hands-on work.
23418,45-3031.00,E0,E0,"The core activity—physically moving fish from catch sites to plants or buyers—requires boats, vehicles, and manual handling. An LLM can offer routing tips or paperwork help, but it cannot eliminate or halve the time spent on the essential physical transport work."
23416,45-3031.00,E0,E0,The task is primarily physical manual labor—physically attaching gear to fishing equipment—which an LLM cannot perform or meaningfully accelerate by 50% through text assistance alone.
23425,45-3031.00,E0,E0,"The primary value delivered is hands-on, in-person instruction and real-time guidance in a physical environment (safety, terrain navigation, weapon handling, locating prey). While an LLM can help draft lesson plans or safety checklists, that preparatory paperwork is a small fraction of the total job time, so access to the LLM would not cut overall task time by half."
23420,45-3031.00,E0,E0,Requires on-site physical work handling trapped animals and moving them to cages; an LLM cannot perform or meaningfully speed up these manual actions.
23417,45-3031.00,E0,E0,"The core work—physically handling wildlife, setting traps, collecting field samples, and carrying out disease-control measures—requires on-site manual labor and direct interaction with animals. An LLM can only offer guidance or documentation help, which would not cut the task time in half."
14906,47-2142.00,E0,E0,"The task is entirely hands-on, requiring physical manipulation of wallpaper with tools; access to an LLM provides no meaningful time savings."
14907,47-2142.00,E0,E0,"This is a hands-on, physical activity requiring the worker to manually handle wallpaper strips, straightedges, and knives. An LLM cannot perform or meaningfully accelerate the cutting itself, so access to the model would not halve the time needed to complete the task."
14908,47-2142.00,E0,E0,The task is purely physical—manually cutting wallpaper with knives at ceilings or baseboards. Access to an LLM cannot meaningfully reduce the time required because the core activity requires on-site physical action.
14909,47-2142.00,E0,E0,"This task is a hands-on visual inspection of physical walls; the worker must be on-site to look for alignment, pattern matches, and seam quality. An LLM (even with image capabilities) cannot meaningfully reduce the time required, since simply looking at the wall is quicker and more reliable than photographing, uploading, and consulting the model."
14910,47-2142.00,E0,E0,"Marking vertical guidelines on physical walls is a hands-on, manual activity that must be performed on-site with tools like plumb bobs and chalk lines; chat-based LLM access cannot meaningfully shorten the time to complete it."
14911,47-2142.00,E0,E0,"The core work is hands-on physical installation of wallpaper/fabric using tools; an LLM can only give verbal guidance, so it cannot cut the task time by half."
14912,47-2142.00,E0,E0,"The task is a manual, physically embodied activity (applying adhesive to wallpaper) that cannot be meaningfully sped up by access to an LLM or software layers; it still requires hands-on labor."
14913,47-2142.00,E0,E0,"This task is a hands-on physical activity—accurately measuring and cutting wallpaper or fabric with tools. An LLM cannot directly perform or meaningfully accelerate the manual work, so access to it would not halve completion time."
14914,47-2142.00,E0,E0,"The task is primarily manual, requiring physical placement and alignment of wallpaper; an LLM cannot perform or substantially accelerate such hands-on work."
14915,47-2142.00,E0,E0,"Filling holes and cracks in walls is a hands-on, physical activity; access to an LLM cannot meaningfully reduce the time required to perform the manual repair work."
14916,47-2142.00,E0,E2,"Accurately measuring walls/ceilings is a hands-on activity done at the job site; an LLM can’t take the measurements or observe the space, so it cannot cut work time in half."
14917,47-2142.00,E0,E0,"The task is a hands-on, physical activity (applying sizing to walls) that cannot be performed or appreciably sped up by text-based assistance alone."
14918,47-2142.00,E0,E0,"The task is manual, requiring physical sanding of walls and ceilings; access to an LLM cannot meaningfully reduce the time needed to perform this hands-on work."
14919,47-2142.00,E0,E0,"Setting up pasteboards and scaffolds is a physical, hands-on activity; LLM access cannot meaningfully reduce the time required to perform the manual setup."
14920,47-2142.00,E0,E0,The task is a hands-on physical activity—scraping and stripping wallpaper with tools and solvents—which cannot be materially sped up by text-based advice alone; it requires on-site manual labor that an LLM cannot perform or halve in duration.
14921,47-2142.00,E0,E0,The task requires physical application of glue to surfaces with tools; an LLM cannot perform or significantly speed up this hands-on manual labor.
14922,47-2142.00,E0,E0,The task is entirely physical (mixing paste and brushing it on walls). Access to an LLM cannot replace or substantially speed up the manual labor involved.
14923,47-2142.00,E0,E0,The task is purely physical—traveling to locations and manually stapling or tacking posters. An LLM cannot perform or meaningfully accelerate this hands-on activity through text assistance alone.
14924,47-2142.00,E0,E0,"This task is hands-on physical labor (applying chemicals, scrubbing, cleaning surfaces). An LLM cannot perform or meaningfully speed up the manual removal process, so direct access to the model does not halve the time required."
14925,47-2142.00,E0,E0,"The task is a hands-on physical activity—physically treating damp plaster with acetic acid—which an LLM can at best only describe; the actual work still must be performed manually, so access to the model would not halve completion time."
13574,47-2181.00,E0,E2,"The core activity—physically climbing onto roofs, probing materials, and closely examining damage—cannot be automated or sped up by a text-only LLM in a way that would cut the total task time by half; the necessary hands-on inspection remains unchanged."
13586,47-2181.00,E0,E0,"The task is entirely physical—clearing snow, water, or debris from rooftops—and cannot be meaningfully sped up by text-based assistance from an LLM."
13575,47-2181.00,E0,E0,"Erecting scaffolding is a hands-on, physical activity; while an LLM could give written guidance, it cannot perform or meaningfully speed up the manual setup itself, so access to it would not cut task time by half."
20793,47-2181.00,E1,E2,"Once the roofer has basic roof measurements, slope, desired material type, local labor rates, and waste factors (all text-based inputs that fit easily under 2,000 words), an LLM can quickly calculate total surface area, convert that to bundles or squares of shingles, add underlayment, flashing, nails, and estimate crew hours and cost—producing a detailed bill of materials and labor quote in minutes. This cuts the desk-time for preparing an estimate by well over half compared with doing the math and write-up manually."
13578,47-2181.00,E0,E0,This task is hands-on physical labor—applying flashing with cement or nails on a roof. Access to an LLM cannot materially shorten the time needed for the physical installation work itself.
13584,47-2181.00,E0,E0,"Installing shingles is a hands-on, physically demanding activity that requires workers to be on the roof positioning and fastening materials. Access to an LLM cannot meaningfully reduce the time required to do this manual labor, as the critical steps are entirely physical."
13580,47-2181.00,E0,E0,"The task requires on-site physical measurement and cutting of roofing materials, which must be done manually with tools; an LLM cannot meaningfully reduce the time needed to perform this hands-on work."
13592,47-2181.00,E0,E0,This is a hands-on physical roofing activity requiring manual placement of materials on a roof; an LLM can offer instructions but cannot perform or meaningfully speed up the manual labor.
13579,47-2181.00,E0,E0,Installation and repair of roofing systems is hands-on physical work requiring on-site manual labor and tool use; access to an LLM cannot meaningfully cut the time to perform these activities.
20794,47-2181.00,E0,E0,"The task requires on-site physical labor—measuring, aligning, and fastening roofing paper—none of which can be materially sped up by text-based advice alone; thus the LLM offers negligible time savings."
13585,47-2181.00,E0,E0,"The task is manual, physical installation of roofing materials with hand tools; access to an LLM cannot meaningfully reduce the time required or perform the physical work."
13590,47-2181.00,E0,E0,"The task is hands-on physical work (painting, spraying, attaching membranes) that requires being on-site with tools and materials; an LLM cannot meaningfully reduce the time needed to perform it."
19851,47-2181.00,E0,E0,"Coating a roof is a hands-on, physical activity; access to an LLM (even with image tools) cannot replace or halve the time required for the manual application of paints or roofing sheets."
13587,47-2181.00,E0,E0,"This task consists of manual, physical application of asphalt/tar and roofing paper on rooftops, which cannot be performed or substantially accelerated by a text-based LLM."
13581,47-2181.00,E0,E0,"Installing vapor barriers or insulation on roofs is a hands-on construction activity that requires physical labor and tool use; an LLM can at best give written instructions, but cannot cut the manual installation time by half."
13583,47-2181.00,E0,E0,"This task is a hands-on, physical activity requiring a worker to climb onto a roof and manually apply roofing cement or caulk. An LLM can provide written instructions but cannot perform or meaningfully speed up the manual labor, so direct access to the model would not halve the time needed."
